{
  "$schema": "https://json-schema.org/draft/2020-12/schema",
  "title": "CashGuard spending priors (backend/data/priors.json)",
  "description": "Single-adult priors for VARIABLE spending, read by E6 (baselines, arch 5.3.5) and E8 (short-history forecast). Fixed costs (housing_rent, utilities, telecom, subscriptions) have no prior: they come from each person's fixed costs and recurring detection (David G., D-variable). E6: for the household-scaled categories of app.domain.enums.HOUSEHOLD_SCALED_CATEGORIES the prior is x household_scale x city_index, except kids, which is PER CHILD: x number of children (0 children -> 0) x city_index (D-kids); every other category uses the plain prior. Blend with the person's history: (n*personal + 5*prior)/(n + 5). All values are fictional, in RON, at Bucharest prices. Load it strictly: numbers as Decimal, duplicate keys and NaN / Infinity rejected, as tests/unit/datafiles.py parse_json does.",
  "type": "object",
  "additionalProperties": false,
  "required": ["categories", "cities", "city_ignored_words", "default_city_index"],
  "properties": {
    "categories": {
      "description": "Every variable spending category of arch 4.5: not transfers, income, savings (not spending) and not the fixed costs.",
      "type": "object",
      "propertyNames": {
        "enum": [
          "groceries", "restaurants", "food_delivery", "transport", "fuel", "electronics",
          "clothing", "sport", "health_pharmacy", "kids", "education", "books", "entertainment",
          "travel", "gifts", "pets", "household_goods", "personal_care", "other"
        ]
      },
      "required": [
        "groceries", "restaurants", "food_delivery", "transport", "fuel", "electronics",
        "clothing", "sport", "health_pharmacy", "kids", "education", "books", "entertainment",
        "travel", "gifts", "pets", "household_goods", "personal_care", "other"
      ],
      "additionalProperties": { "$ref": "#/$defs/prior" }
    },
    "cities": {
      "description": "City indices (arch 5.3.5). A user's city matches a city when key(city) equals key(one of its names), key = app.i18n.text.fold, every run of non-letters/digits as a separator, the city_ignored_words and pure numbers dropped, the remaining words joined without spaces ('Municipiul Bucuresti, Sector 3' -> 'bucuresti', 'Cluj Napoca' -> 'clujnapoca').",
      "type": "array",
      "minItems": 1,
      "items": { "$ref": "#/$defs/city" }
    },
    "city_ignored_words": {
      "description": "Folded words dropped by the city key: administrative prefixes, the country, Bucharest's sectors.",
      "type": "array",
      "uniqueItems": true,
      "items": { "type": "string", "pattern": "^[a-z]+$" }
    },
    "default_city_index": {
      "description": "The index of a city that isn't listed (E6: unknown city -> 1.0).",
      "$ref": "#/$defs/index"
    }
  },
  "$defs": {
    "amount": { "type": "number", "exclusiveMinimum": 0, "maximum": 10000 },
    "index": { "type": "number", "exclusiveMinimum": 0, "maximum": 2 },
    "prior": {
      "type": "object",
      "additionalProperties": false,
      "required": ["monthly_mean", "basket_median", "basket_cv", "cv"],
      "properties": {
        "monthly_mean": {
          "description": "A single adult's MEAN monthly spending in this category, RON (kids: per child). A mean, not a median: for lumpy categories the median month is about 0. E6 monthly_expected; E8 lognormal by its mean.",
          "$ref": "#/$defs/amount"
        },
        "basket_median": {
          "description": "A single adult's median single transaction in this category, RON (E6 prior_median).",
          "$ref": "#/$defs/amount"
        },
        "basket_cv": {
          "description": "The spread of one transaction's amount (lognormal coefficient of variation).",
          "type": "number",
          "exclusiveMinimum": 0,
          "maximum": 3
        },
        "cv": {
          "description": "Coefficient of variation of the MONTHLY total under a compound Poisson model: purchases at rate monthly_mean / (basket_median * sqrt(1 + basket_cv^2)), each a lognormal amount; cv = sqrt((1 + basket_cv^2)^1.5 * basket_median / monthly_mean). Lumpy categories (a basket above the month) reach ~3.5, hence the cap of 5 (the spec's 2 was too low). For E8 (arch 6.7 uses a flat 0.25; danutu decides). Seasonal for E8: gifts (December, March, Easter), travel (summer), kids (school start, 1 June, December), clothing (season changes); dates in data/calendar.json.",
          "type": "number",
          "exclusiveMinimum": 0,
          "exclusiveMaximum": 5
        }
      }
    },
    "city": {
      "type": "object",
      "additionalProperties": false,
      "required": ["id", "names", "index"],
      "properties": {
        "id": { "type": "string", "pattern": "^[a-z0-9]+(_[a-z0-9]+)*$", "maxLength": 40 },
        "names": {
          "type": "array",
          "minItems": 1,
          "uniqueItems": true,
          "items": { "type": "string", "minLength": 2, "maxLength": 60 }
        },
        "index": { "$ref": "#/$defs/index" }
      }
    }
  }
}
